{
  "quote_request": {
    "request_meta": {
      "request_id": "qr-demo-001",
      "source": "assessment_report",
      "prepared_at": "2026-04-09T06:39:59.068439+00:00",
      "language": "zh-CN"
    },
    "header_context": {
      "currency": "USD",
      "vessel_name": "MV EXAMPLE",
      "imo_no": "1234567",
      "vessel_type": "Tanker",
      "customer_name": "ABC Shipping",
      "service_port": "Zhapu Port, China",
      "service_date": null,
      "attention": null,
      "customer_ref_no": null
    },
    "service_context": {
      "service_category": "service",
      "service_mode": "voyage_repair",
      "location_type": "port",
      "needs_multi_option": true,
      "option_hints": [
        "Option A Standard quotation",
        "Option B 5% discount quotation"
      ],
      "urgency": null
    },
    "candidate_items": [
      {
        "item_id": "svc-1",
        "item_type": "service",
        "title": "AE-1 crankshaft trueness checks in place",
        "description": "Working time abt 15 hours",
        "work_scope": [
          "2pcs M/B lower bearing remove",
          "Crankshaft run-out check by magnetic gauge"
        ],
        "quantity_hint": 1,
        "unit_hint": "job",
        "labor_hint": [
          "1 supervisor",
          "2 fitters"
        ],
        "pricing_clues": [],
        "status_hint": null,
        "source": "assessment_report"
      },
      {
        "item_id": "spr-1",
        "item_type": "spare_parts",
        "title": "Main bearing spare parts",
        "description": "Subject to final spare parts confirmation",
        "work_scope": [],
        "quantity_hint": null,
        "unit_hint": null,
        "labor_hint": [],
        "pricing_clues": [],
        "status_hint": null,
        "source": "assessment_report"
      },
      {
        "item_id": "oth-1",
        "item_type": "other",
        "title": "Transportation and accommodation",
        "description": "Travel and hotel arrangement for service attendance",
        "work_scope": [],
        "quantity_hint": 2,
        "unit_hint": "person-day",
        "labor_hint": [],
        "pricing_clues": [
          "travel",
          "hotel"
        ],
        "status_hint": null,
        "source": "assessment_report"
      }
    ],
    "spare_parts_context": {
      "has_spare_parts": true,
      "spare_parts_supply_mode": null,
      "spare_parts_items": []
    },
    "risk_context": {
      "risks": [],
      "pending_confirmations": [
        "Whether spare parts are owner supply"
      ],
      "assumptions": []
    },
    "commercial_context": {
      "preferred_currency": "USD",
      "pricing_expectation": null,
      "special_terms": []
    },
    "source_refs": {
      "assessment_report_id": "demo-001",
      "customer_context_ref": null,
      "business_context_ref": null
    }
  },
  "feasibility_result": {
    "can_quote": true,
    "quote_scope": "partial",
    "quotable_items": [
      {
        "item_id": "svc-1",
        "item_type": "service",
        "title": "AE-1 crankshaft trueness checks in place",
        "decision": "quotable",
        "reason": "服务项标题和范围已基本明确，可进入报价。",
        "blocking_fields": [],
        "suggested_status": "chargeable",
        "source": "quote_request.candidate_items"
      },
      {
        "item_id": "oth-1",
        "item_type": "other",
        "title": "Transportation and accommodation",
        "decision": "quotable",
        "reason": "附加费用可按标准口径预估报价。",
        "blocking_fields": [],
        "suggested_status": "chargeable",
        "source": "quote_request.candidate_items"
      }
    ],
    "tbc_items": [
      {
        "item_id": "spr-1",
        "item_type": "spare_parts",
        "title": "Main bearing spare parts",
        "decision": "tbc",
        "reason": "备件供货责任未确认，当前只能待确认。",
        "blocking_fields": [
          "spare_parts_context.spare_parts_supply_mode"
        ],
        "suggested_status": "pending",
        "source": "quote_request.candidate_items"
      }
    ],
    "exclusions": [],
    "missing_fields": [],
    "questions_for_user": [],
    "review_flags": []
  },
  "historical_reference": {
    "matches": [
      {
        "quote_id": "hist-001",
        "similarity": 0.74,
        "reason": "核心项目工作范围、文本语义与服务场景相似。",
        "matched_features": [
          "service_mode: voyage_repair"
        ],
        "reference_items": [
          "AE-1 crankshaft trueness checks in place"
        ],
        "reference_remarks": [
          "Other repair if needed to be charged extra"
        ],
        "match_level": "strong_item_match",
        "matched_item_pairs": [
          {
            "query_item_id": "svc-1",
            "query_title": "AE-1 crankshaft trueness checks in place",
            "reference_item_id": "hist-001-svc-1",
            "reference_title": "AE-1 crankshaft trueness checks in place",
            "similarity": 0.57,
            "matched_signals": [
              "item_type_match: service",
              "item_title: AE-1 crankshaft trueness checks in place"
            ]
          }
        ],
        "commercial_fit": {
          "spare_parts_supply_mode_match": false,
          "option_style_overlap": [
            "standard_vs_discount"
          ]
        },
        "prefilter_score": 0.85,
        "semantic_score": 0.89,
        "rerank_stage": "hybrid"
      }
    ],
    "reference_summary": {
      "price_range_hint": {
        "currency": "USD",
        "min": 3200.0,
        "max": 3800.0,
        "sample_size": 2
      },
      "common_items": [
        "AE-1 crankshaft trueness checks in place"
      ],
      "remark_patterns": [
        "Other repair if needed to be charged extra"
      ],
      "recommended_reference_ids": [
        "hist-001"
      ],
      "item_clusters": [],
      "remark_blocks": [],
      "charge_item_hints": [],
      "option_style_hints": [],
      "history_quality_flags": [
        "low_item_sample_size"
      ],
      "item_price_hints": [
        {
          "query_item_id": "svc-1",
          "query_title": "AE-1 crankshaft trueness checks in place",
          "currency": "USD",
          "min": 3200.0,
          "max": 3500.0,
          "median": 3350.0,
          "sample_size": 2,
          "matched_reference_item_ids": [
            "hist-001-svc-1",
            "hist-002-svc-1"
          ],
          "source_quote_ids": [
            "hist-001",
            "hist-002"
          ]
        }
      ],
      "retrieval_strategy": "rule_prefilter+tfidf_fallback"
    },
    "confidence": 0.82
  },
  "pricing_rules": {
    "currency": "USD",
    "service_rates": {
      "mechanical_supervisor_hourly": 55.0,
      "mechanical_technician_hourly": 35.0,
      "electrical_supervisor_hourly": 60.0,
      "electrical_assistant_hourly": 40.0,
      "service": 3500.0,
      "spare_parts": 800.0,
      "other": 300.0
    },
    "lump_sum_overrides": {
      "spr-1": 800.0
    },
    "multi_option_mode": true,
    "remark_hints": [
      "Other repair if needed to be charged extra"
    ],
    "default_discount_percentage": 5.0,
    "discount_overrides": {},
    "pricing_multipliers": {
      "spare_parts_oem": 1.25,
      "spare_parts_alternative": 1.5,
      "freight": 1.35,
      "delivery": 1.35,
      "third_party": 1.4,
      "dock_port_service": 1.3,
      "dockyard_management": 1.2,
      "boarding_travel": 1.2
    },
    "charge_bases": {
      "third_party_base": 1200.0,
      "freight_base": 300.0,
      "delivery_base": 260.0,
      "transportation_base": 450.0,
      "accommodation_daily": 45.0,
      "port_service_base": 150.0,
      "maritime_reporting_base": 150.0,
      "dockyard_management_base": 200.0,
      "boarding_travel_base": 180.0
    }
  }
}
